<?xml version="1.0" encoding="UTF-8"?>
<p:Graph xmlns:p="http://www.pubflow.uni-kiel.de" xmlns:xsi="http://www.w3.org/2001/XMLSchema-instance" xsi:schemaLocation="http://www.pubflow.uni-kiel.de ../../../.temp/graphflow.xsd ">
  <p:NodeList>
    <p:PortNode Label="I am porty" NodeID="pnode1" IconID="testicon">
      <p:DataObject IsArray="false" Key="data">
        <p:DataString Key="$foo" Value="bar"/>
        <p:DataNumber Key="$noo" Value="1337"/>
        <p:DataBoolean Key="$boo" Value="true"/>
        <p:DataObject IsArray="true" Key="$arr">
        	 <p:DataString Key="0" Value="zero"/>
        	 <p:DataString Key="1" Value="one"/>
        	 <p:DataString Key="2" Value="two"/>
        </p:DataObject>
        <p:DataObject IsArray="false" Key="$obji">
        	 <p:DataString Key="$key1" Value="val1"/>
        	 <p:DataString Key="$key2" Value="val2"/>
        	 <p:DataString Key="$key3" Value="val3"/>
        </p:DataObject>
      </p:DataObject>
      <p:Port PortID="p1port1" PortType="input"/>
      <p:Port PortID="p1port2" PortType="input"/>
      <p:Port PortID="p1port3" PortType="input"/>
      <p:Port PortID="p1port4" PortType="output"/>
      <p:Port PortID="p1port5" PortType="repository"/>
    </p:PortNode>
	 <p:PortNode Label="I am a\nsporty\nporty 2" NodeID="pnode2" Tooltip="omg tooltip!">
      <p:Port PortID="p2port1" PortType="input"/>
      <p:Port PortID="p2port2" PortType="output"/>
    </p:PortNode>
	 <p:CustomNode Label="I am customized" NodeID="cnode1" Type="nodeFamily">
		<p:DataObject IsArray="false" Key="data">
        <p:DataString Key="$coo" Value="barbara"/>
		  <p:DataNumber Key="$dim" Value="50"/>
		  <p:DataNumber Key="$width" Value="100"/>
		  <p:DataNumber Key="$height" Value="50"/>
		</p:DataObject>
    </p:CustomNode>
  </p:NodeList>
  <p:EdgeList>
    <p:Edge Label="woo!\ni is edge" Source="p1port4" Target="p2port1" Type="flowArrow">
      <p:DataObject IsArray="false" Key="data">
        <p:DataString Key="$edgeFoo" Value="edgeBar"/>
      </p:DataObject>
    </p:Edge>
  </p:EdgeList>
  <p:LayoutData MarkFillColor="#000099" MarkStrokeColor="#AAAAAA" EdgeColor="green" HoverStrokeColor="gray">
    <p:NodeStyle FillColor="white" StrokeColor="black" TextColor="red" Font="Arial Black" Type="#all"/>
	 <p:Icon IconID="testicon" URL="http://icons.iconarchive.com/icons/hopstarter/sleek-xp-software/256/Yahoo-Messenger-icon.png"/>
  </p:LayoutData>
</p:Graph>